{
  "$schema": "./node-safe.schema.json",
  "$readme": "https://github.com/berstend/node-safe#readme",

  "node": {
    "allow-read": "./data/**",
    "custom": ["a", "b"]
  },

  "scripts": {
    "foobar": {}
  },

  "commands": {
    "whoami": {
      "allow-read": "./foo/**",
      "allow-net-inbound": true
    }
  }
}
